{
  "schema_version": 1,
  "status": "FEASIBLE",
  "cp_sat_status": "OPTIMAL",
  "mode": "free",
  "goal": "feasibility",
  "scope": "geometry_only",
  "city": {
    "schema_version": 1,
    "name": "Mine Low ER - 4 Garage + HR50",
    "width": 20,
    "height": 20,
    "placements": [
      {
        "id": "p01",
        "facility_id": 82,
        "x": 9,
        "y": 10,
        "orientation": "v",
        "fixed": true
      },
      {
        "id": "p02",
        "facility_id": 82,
        "x": 9,
        "y": 13,
        "orientation": "v",
        "fixed": true
      },
      {
        "id": "p03",
        "facility_id": 3,
        "x": 1,
        "y": 0,
        "orientation": "h",
        "fixed": true
      },
      {
        "id": "p04",
        "facility_id": 3,
        "x": 3,
        "y": 1,
        "orientation": "v",
        "fixed": true
      },
      {
        "id": "p05",
        "facility_id": 3,
        "x": 1,
        "y": 18,
        "orientation": "h",
        "fixed": true
      },
      {
        "id": "p06",
        "facility_id": 3,
        "x": 6,
        "y": 19,
        "orientation": "h",
        "fixed": true
      },
      {
        "id": "p07",
        "facility_id": 20,
        "x": 5,
        "y": 0,
        "orientation": "h",
        "fixed": true
      },
      {
        "id": "p08",
        "facility_id": 20,
        "x": 8,
        "y": 0,
        "orientation": "h",
        "fixed": true
      },
      {
        "id": "p09",
        "facility_id": 20,
        "x": 12,
        "y": 0,
        "orientation": "h",
        "fixed": true
      },
      {
        "id": "p10",
        "facility_id": 82,
        "x": 9,
        "y": 16,
        "orientation": "v",
        "fixed": true
      },
      {
        "id": "p11",
        "facility_id": 7,
        "x": 5,
        "y": 2,
        "orientation": "v",
        "fixed": true
      },
      {
        "id": "p12",
        "facility_id": 4,
        "x": 5,
        "y": 18,
        "orientation": "h",
        "fixed": true
      },
      {
        "id": "p13",
        "facility_id": 4,
        "x": 2,
        "y": 19,
        "orientation": "h",
        "fixed": true
      },
      {
        "id": "p14",
        "facility_id": 82,
        "x": 13,
        "y": 16,
        "orientation": "v",
        "fixed": true
      },
      {
        "id": "p15",
        "facility_id": 82,
        "x": 17,
        "y": 16,
        "orientation": "v",
        "fixed": true
      },
      {
        "id": "p16",
        "facility_id": 2,
        "x": 1,
        "y": 1,
        "orientation": "v",
        "fixed": true
      },
      {
        "id": "p17",
        "facility_id": 7,
        "x": 13,
        "y": 9,
        "orientation": "v",
        "fixed": true
      },
      {
        "id": "p18",
        "facility_id": 49,
        "x": 1,
        "y": 11,
        "orientation": "v",
        "fixed": true
      },
      {
        "id": "p19",
        "facility_id": 2,
        "x": 16,
        "y": 0,
        "orientation": "h",
        "fixed": true
      },
      {
        "id": "p20",
        "facility_id": 70,
        "x": 10,
        "y": 19,
        "orientation": "h",
        "fixed": true
      },
      {
        "id": "p21",
        "facility_id": 4,
        "x": 0,
        "y": 11,
        "orientation": "v",
        "fixed": true
      },
      {
        "id": "p22",
        "facility_id": 4,
        "x": 9,
        "y": 9,
        "orientation": "h",
        "fixed": true
      },
      {
        "id": "p23",
        "facility_id": 44,
        "x": 0,
        "y": 5,
        "orientation": "v",
        "fixed": true
      },
      {
        "id": "p24",
        "facility_id": 49,
        "x": 13,
        "y": 1,
        "orientation": "v",
        "fixed": true
      },
      {
        "id": "p25",
        "facility_id": 2,
        "x": 5,
        "y": 9,
        "orientation": "h",
        "fixed": true
      },
      {
        "id": "p26",
        "facility_id": 2,
        "x": 0,
        "y": 15,
        "orientation": "v",
        "fixed": true
      },
      {
        "id": "p27",
        "facility_id": 70,
        "x": 14,
        "y": 19,
        "orientation": "h",
        "fixed": true
      },
      {
        "id": "p28",
        "facility_id": 70,
        "x": 4,
        "y": 1,
        "orientation": "v",
        "fixed": true
      },
      {
        "id": "p29",
        "facility_id": 70,
        "x": 0,
        "y": 1,
        "orientation": "v",
        "fixed": true
      },
      {
        "id": "add-1-1",
        "facility_id": 1,
        "x": 0,
        "y": 19,
        "orientation": "v",
        "fixed": false
      }
    ],
    "designer_state": "|4|v",
    "source_url": null
  },
  "geometry_valid": true,
  "additions_placed": 1,
  "objective_value": null,
  "best_bound": null,
  "relative_gap": null,
  "build_seconds": 0.0734457999933511,
  "solve_seconds": 34.33191639999859,
  "total_seconds": 34.40712360001635,
  "time_limit_seconds": 120.0,
  "workers": 8,
  "random_seed": 0,
  "use_hints": true,
  "symmetry_breaking": true,
  "solver_version": "9.15.6755",
  "rules_version": "geometry-v1",
  "catalog_sha256": "3a5462537b7c59754f11fe3b6f3fc0a486c3d37c9c9fe70b44c728b31542b91f",
  "request_sha256": "4b39e1e6562e062072d88fb60526750e22da6461ac0629347dd7384fd39549d6",
  "assumption_ids": [
    "border-is-not-road",
    "placement-grid"
  ],
  "unchecked": [
    "power",
    "terrain",
    "special_restrictions",
    "economics"
  ],
  "model_stats": "satisfaction model '': (model_fingerprint: 0x834603f368af4c68)\n#Variables: 3'780 (3'679 primary variables)\n  - 3'660 Booleans in [0,1]\n  - 60 in [0,19]\n  - 2 in [0,21]\n  - 48 in [0,23]\n  - 2 in [0,25]\n  - 8 in [0,27]\n#kBoolOr: 3'480 (#enforced: 3'480 #multi: 3'480) (#literals: 13'920)\n#kInterval: 60 (#enforced: 60)\n#kLinear1: 221 (#enforced: 180)\n#kLinear2: 7'122 (#enforced: 6'960)\n#kLinear3: 38\n#kLinearN: 50 (#enforced: 20 #multi: 20) (#terms: 230)\n#kNoOverlap2D: 1 (#rectangles: 30, #optional: 30, #quadratic_areas: 19)",
  "message": "Independently validated layout found; no optimization proof claimed."
}
