{
  "schema_version": 1,
  "status": "PROVEN_OPTIMAL",
  "cp_sat_status": "OPTIMAL",
  "mode": "fixed",
  "goal": "max_additions",
  "scope": "geometry_only",
  "city": {
    "schema_version": 1,
    "name": "Small fixed-city demonstration",
    "width": 5,
    "height": 5,
    "placements": [
      {
        "id": "office",
        "facility_id": 2,
        "x": 2,
        "y": 1,
        "orientation": "v",
        "fixed": true
      },
      {
        "id": "add-1-1",
        "facility_id": 1,
        "x": 0,
        "y": 1,
        "orientation": "v",
        "fixed": false
      },
      {
        "id": "add-1-2",
        "facility_id": 1,
        "x": 1,
        "y": 1,
        "orientation": "v",
        "fixed": false
      },
      {
        "id": "add-1-3",
        "facility_id": 1,
        "x": 3,
        "y": 1,
        "orientation": "v",
        "fixed": false
      },
      {
        "id": "add-1-4",
        "facility_id": 1,
        "x": 1,
        "y": 3,
        "orientation": "v",
        "fixed": false
      }
    ],
    "designer_state": "",
    "source_url": null
  },
  "geometry_valid": true,
  "additions_placed": 4,
  "objective_value": 4,
  "best_bound": 4.0,
  "relative_gap": 0.0,
  "build_seconds": 0.009000299964100122,
  "solve_seconds": 0.05600179999601096,
  "total_seconds": 0.06566640001256019,
  "time_limit_seconds": 30.0,
  "workers": 1,
  "random_seed": 0,
  "use_hints": true,
  "symmetry_breaking": true,
  "solver_version": "9.15.6755",
  "rules_version": "geometry-v1",
  "catalog_sha256": "3a5462537b7c59754f11fe3b6f3fc0a486c3d37c9c9fe70b44c728b31542b91f",
  "request_sha256": "f9661fdb9ad18d7878b0ae8283fc56d4aec8c10a8d37238d8a8d32d77abd33da",
  "assumption_ids": [
    "border-is-not-road",
    "placement-grid"
  ],
  "unchecked": [
    "power",
    "terrain",
    "special_restrictions",
    "economics"
  ],
  "model_stats": "optimization model '': (model_fingerprint: 0x8454d68e2eb26b4f)\n#Variables: 130 (#bools: 4 in objective) (112 primary variables)\n  - 110 Booleans in [0,1]\n  - 10 in [0,4]\n  - 8 in [0,6]\n  - 2 in [0,8]\n#kBoolOr: 80 (#enforced: 80 #multi: 80) (#literals: 320)\n#kInterval: 10 (#enforced: 10)\n#kLinear1: 38 (#enforced: 30)\n#kLinear2: 191 (#enforced: 160)\n#kLinear3: 2\n#kLinearN: 8 (#enforced: 3 #multi: 3) (#terms: 37)\n#kNoOverlap2D: 1 (#rectangles: 5, #optional: 5, #quadratic_areas: 1)",
  "message": "Maximum addition count proved within the requested inventory and geometry rules."
}
