{
  "schema_version": 1,
  "status": "PROVEN_INFEASIBLE",
  "cp_sat_status": "INFEASIBLE",
  "mode": "fixed",
  "goal": "feasibility",
  "scope": "geometry_only",
  "city": null,
  "geometry_valid": null,
  "additions_placed": null,
  "objective_value": null,
  "best_bound": null,
  "relative_gap": null,
  "build_seconds": 0.06097840005531907,
  "solve_seconds": 0.027536700014024973,
  "total_seconds": 0.08855560002848506,
  "time_limit_seconds": 30.0,
  "workers": 1,
  "random_seed": 0,
  "use_hints": true,
  "symmetry_breaking": true,
  "solver_version": "9.15.6755",
  "rules_version": "geometry-v1",
  "catalog_sha256": "3a5462537b7c59754f11fe3b6f3fc0a486c3d37c9c9fe70b44c728b31542b91f",
  "request_sha256": "b8ec6ab7da846d8790ea8897bab9a8a9d49f691fa3701a82d24c612c43ed3368",
  "assumption_ids": [
    "border-is-not-road",
    "placement-grid"
  ],
  "unchecked": [
    "power",
    "terrain",
    "special_restrictions",
    "economics"
  ],
  "model_stats": "satisfaction model '': (model_fingerprint: 0x119cc1ae6fdee87e)\n#Variables: 3'780 (3'602 primary variables)\n  - 3'660 Booleans in [0,1]\n  - 60 in [0,19]\n  - 2 in [0,21]\n  - 48 in [0,23]\n  - 2 in [0,25]\n  - 8 in [0,27]\n#kBoolOr: 3'480 (#enforced: 3'480 #multi: 3'480) (#literals: 13'920)\n#kInterval: 60 (#enforced: 60)\n#kLinear1: 298 (#enforced: 180)\n#kLinear2: 7'102 (#enforced: 6'960)\n#kLinear3: 38\n#kLinearN: 30 (#terms: 150)\n#kNoOverlap2D: 1 (#rectangles: 30, #optional: 30, #quadratic_areas: 19)",
  "message": "Requested inventory proved infeasible under the encoded geometry rules."
}
